{
  "id": "oo-2026-05-11-ai-governance-signal",
  "title": "AI governance is becoming operational infrastructure, not only policy language",
  "slug": "ai-governance-operational-infrastructure",
  "status": "draft",
  "language": "en",
  "created_at": "2026-05-11T12:00:00+02:00",
  "updated_at": "2026-05-11T12:00:00+02:00",
  "signal": {
    "summary": "AI governance is moving from principles and guidelines toward runtime controls, approvals, audit trails, and execution boundaries.",
    "signal_type": "governance",
    "why_now": "Organizations are adopting agentic systems faster than their existing review and accountability processes can control them."
  },
  "context": "The practical gap is no longer only model capability. The gap is controlled execution: who can act, under which policy, with which evidence, and with what audit trail.",
  "noise_level": "medium",
  "impact_horizon": "months",
  "who_should_care": [
    "AI product teams",
    "governance leaders",
    "media organizations",
    "public-sector innovation teams"
  ],
  "systemic_effects": [
    "Governance becomes a runtime requirement rather than a document-only requirement.",
    "Approval centers, source tracking, and audit evidence become product features.",
    "Trustworthy AI systems need visible limits, not only better prompts."
  ],
  "next_orientation_step": "Map which AI actions are draft-only, which require human approval, and which are blocked until signed connectors exist.",
  "sources": [
    {
      "title": "AI Cabinet local repository architecture",
      "url": "https://example.invalid/local-ai-cabinet-architecture",
      "source_type": "internal",
      "publisher": "AI Cabinet",
      "published_at": null,
      "last_checked": "2026-05-11",
      "confidence": "medium",
      "notes": "Internal repository source. Replace placeholder URL with repository path or public documentation before publication."
    }
  ],
  "confidence": {
    "level": "medium",
    "rationale": "The pattern is visible in the current AI Cabinet design, but public publication needs external source validation.",
    "last_checked": "2026-05-11"
  },
  "governance": {
    "risk_level": "medium",
    "sensitive_domains": ["reputational"],
    "approval_required": true,
    "approval_status": "not_requested",
    "ai_assisted": true,
    "human_reviewer": null,
    "audit_ids": []
  },
  "distribution": {
    "website": {
      "status": "not_started",
      "draft_path": null
    },
    "newsletter": {
      "status": "not_started",
      "draft_path": null
    },
    "linkedin": {
      "status": "not_started",
      "draft_path": null
    },
    "telegram": {
      "status": "not_started",
      "draft_path": null
    },
    "rss": {
      "status": "not_started",
      "draft_path": null
    }
  },
  "strategic_memory_note": "AI governance should be framed as operational infrastructure when explaining AI Cabinet and Jazekker."
}
